{
  "$schema": "https://schema.management.azure.com/schemas/2019-04-01/deploymentTemplate.json#",
  "contentVersion": "1.0.0.0",
  "parameters": {
    "workspace": {
      "type": "string",
      "defaultValue": "LookoutdemoSentinel",
      "metadata": {
        "description": "Workspace name"
      }
    }
  },
  "variables": {
    "tableName": "LookoutMtdV2_CL"
  },
  "resources": [
    {
      "type": "Microsoft.OperationalInsights/workspaces/tables",
      "apiVersion": "2022-10-01",
      "name": "[concat(parameters('workspace'), '/', variables('tableName'))]",
      "properties": {
        "totalRetentionInDays": 90,
        "plan": "Analytics",
        "schema": {
          "name": "[variables('tableName')]",
          "columns": [
            {
              "name": "TimeGenerated",
              "type": "datetime"
            },
            {
              "name": "RawData",
              "type": "string"
            }
          ]
        }
      }
    }
  ]
}
