{
    "$schema": "https://schema.management.azure.com/schemas/2015-01-01/deploymentTemplate.json#",
    "contentVersion": "1.0.0.0",
    "parameters": {
        "TenablePlatformConnectorName": {
            "defaultValue": "TenablePlatform",
            "type": "string",
            "metadata": {
                "description": "Tenable Platform Connector Name"
            }
        },
        "TenableVulnerabilityManagementConnectorName": {
            "defaultValue": "TenableVulnerabilityManagement",
            "type": "string",
            "metadata": {
                "description": "Tenable Vulnerability Management Connector Name"
            }
        },
        "Tenable-EnrichIncidentWithAssetsInfo_Playbook_Name": {
            "defaultValue": "Tenable-EnrichIncidentWithAssetsInfo",
            "type": "string",
            "metadata": {
                "description": "Name of the Playbook"
            }
        },
        "Tenable-EnrichIncidentWithVulnInfo_Playbook_Name": {
            "defaultValue": "Tenable-EnrichIncidentWithVulnInfo",
            "type": "string",
            "metadata": {
                "description": "Name of the Playbook"
            }
        },
        "Tenable-LaunchScan_Playbook_Name": {
            "defaultValue": "Tenable-LaunchScan",
            "type": "string",
            "metadata": {
                "description": "Name of the Playbook"
            }
        },
        "ScanId": {
            "defaultValue": "",
            "type": "string",
            "metadata": {
                "description": "Scan ID that will be used in Tenable-LaunchScan playbook"
            }
        }
    },
    "variables": {},
    "resources": [
        {
            "name": "TenablePlatformAPIConnector_LinkedTemplate",
            "type": "Microsoft.Resources/deployments",
            "apiVersion": "2018-05-01",
            "properties": {
                "mode": "Incremental",
                "templateLink": {
                    "uri": "https://raw.githubusercontent.com/Azure/Azure-Sentinel/master/Solutions/Tenable%20App/Playbooks/TenablePlatformConnector/azuredeploy.json"
                },
                "parameters": {
                    "ConnectorName": {
                        "Value": "[parameters('TenablePlatformConnectorName')]"
                    }
                }
            }
        },
        {
            "name": "TenableVulnerabilityManagementAPIConnector_LinkedTemplate",
            "type": "Microsoft.Resources/deployments",
            "apiVersion": "2018-05-01",
            "properties": {
                "mode": "Incremental",
                "templateLink": {
                    "uri": "https://raw.githubusercontent.com/Azure/Azure-Sentinel/master/Solutions/Tenable%20App/Playbooks/TenableVulnerabilityManagementConnector/azuredeploy.json"
                },
                "parameters": {
                    "ConnectorName": {
                        "Value": "[parameters('TenableVulnerabilityManagementConnectorName')]"
                    }
                }
            }
        },
        {
            "name": "Tenable-EnrichIncidentWithAssetsInfo_LinkedTemplate",
            "dependsOn": [],
            "type": "Microsoft.Resources/deployments",
            "apiVersion": "2018-05-01",
            "properties": {
                "mode": "Incremental",
                "templateLink": {
                    "uri": "https://raw.githubusercontent.com/Azure/Azure-Sentinel/master/Solutions/Tenable%20App/Playbooks/Playbooks/Tenable-EnrichIncidentWithAssetsInfo/azuredeploy.json"
                },
                "parameters": {
                    "PlaybookName": {
                        "Value": "[parameters('Tenable-EnrichIncidentWithAssetsInfo_Playbook_Name')]"
                    }
                }
            }
        },
        {
            "name": "Tenable-EnrichIncidentWithVulnInfo_LinkedTemplate",
            "dependsOn": [],
            "type": "Microsoft.Resources/deployments",
            "apiVersion": "2018-05-01",
            "properties": {
                "mode": "Incremental",
                "templateLink": {
                    "uri": "https://raw.githubusercontent.com/Azure/Azure-Sentinel/master/Solutions/Tenable%20App/Playbooks/Playbooks/Tenable-EnrichIncidentWithVulnInfo/azuredeploy.json"
                },
                "parameters": {
                    "PlaybookName": {
                        "Value": "[parameters('Tenable-EnrichIncidentWithVulnInfo_Playbook_Name')]"
                    }
                }
            }
        },
        {
            "name": "Tenable-LaunchScan_LinkedTemplate",
            "dependsOn": [
                "[resourceId('Microsoft.Resources/deployments', 'TenableVulnerabilityManagementAPIConnector_LinkedTemplate')]"
            ],
            "type": "Microsoft.Resources/deployments",
            "apiVersion": "2018-05-01",
            "properties": {
                "mode": "Incremental",
                "templateLink": {
                    "uri": "https://raw.githubusercontent.com/Azure/Azure-Sentinel/master/Solutions/Tenable%20App/Playbooks/Playbooks/Tenable-LaunchScan/azuredeploy.json"
                },
                "parameters": {
                    "PlaybookName": {
                        "Value": "[parameters('Tenable-LaunchScan_Playbook_Name')]"
                    },
                    "ScanId": {
                        "Value": "[parameters('ScanId')]"
                    },
                    "TenableVulnerabilityManagementConnectorName": {
                        "Value": "[parameters('TenableVulnerabilityManagementConnectorName')]"
                    }
                }
            }
        }
    ]
}