{
    "$schema": "https://schema.management.azure.com/schemas/2019-04-01/deploymentTemplate.json#",
    "contentVersion": "1.0.0.0",
    "metadata": {
        "description": "Deploys the TrendMicroOAT_Complete parser function to Log Analytics workspace"
    },
    "parameters": {
        "workspace": {
            "type": "string",
            "metadata": {
                "description": "Log Analytics workspace name"
            }
        },
        "workspace-location": {
            "type": "string",
            "metadata": {
                "description": "Workspace Azure region"
            }
        }
    },
    "variables": {
        "functionName": "TrendMicroOAT_Complete",
        "functionAlias": "TrendMicroOAT_Complete",
        "category": "TrendMicro",
        "functionQuery": "union isfuzzy=true\n    // \u2550\u2550\u2550\u2550\u2550\u2550\u2550\u2550\u2550\u2550\u2550\u2550\u2550\u2550\u2550\u2550\u2550\u2550\u2550\u2550\u2550\u2550\u2550\u2550\u2550\u2550\u2550\u2550\u2550\u2550\u2550\u2550\u2550\u2550\u2550\u2550\u2550\u2550\u2550\u2550\u2550\u2550\u2550\u2550\u2550\u2550\u2550\u2550\u2550\u2550\u2550\u2550\u2550\u2550\u2550\u2550\u2550\u2550\u2550\u2550\u2550\u2550\u2550\u2550\u2550\u2550\u2550\u2550\u2550\u2550\u2550\u2550\u2550\u2550\u2550\n    // LEGACY DATA (Azure Function): Use AS-IS (already in correct format)\n    // \u2550\u2550\u2550\u2550\u2550\u2550\u2550\u2550\u2550\u2550\u2550\u2550\u2550\u2550\u2550\u2550\u2550\u2550\u2550\u2550\u2550\u2550\u2550\u2550\u2550\u2550\u2550\u2550\u2550\u2550\u2550\u2550\u2550\u2550\u2550\u2550\u2550\u2550\u2550\u2550\u2550\u2550\u2550\u2550\u2550\u2550\u2550\u2550\u2550\u2550\u2550\u2550\u2550\u2550\u2550\u2550\u2550\u2550\u2550\u2550\u2550\u2550\u2550\u2550\u2550\u2550\u2550\u2550\u2550\u2550\u2550\u2550\u2550\u2550\u2550\n    (TrendMicro_XDR_OAT_CL\n     | extend source_table = \"legacy\"\n    ),\n    // \u2550\u2550\u2550\u2550\u2550\u2550\u2550\u2550\u2550\u2550\u2550\u2550\u2550\u2550\u2550\u2550\u2550\u2550\u2550\u2550\u2550\u2550\u2550\u2550\u2550\u2550\u2550\u2550\u2550\u2550\u2550\u2550\u2550\u2550\u2550\u2550\u2550\u2550\u2550\u2550\u2550\u2550\u2550\u2550\u2550\u2550\u2550\u2550\u2550\u2550\u2550\u2550\u2550\u2550\u2550\u2550\u2550\u2550\u2550\u2550\u2550\u2550\u2550\u2550\u2550\u2550\u2550\u2550\u2550\u2550\u2550\u2550\u2550\u2550\u2550\n    // V2 DATA (CCF Connector): Use AS-IS (schema should match legacy)\n    // \u2550\u2550\u2550\u2550\u2550\u2550\u2550\u2550\u2550\u2550\u2550\u2550\u2550\u2550\u2550\u2550\u2550\u2550\u2550\u2550\u2550\u2550\u2550\u2550\u2550\u2550\u2550\u2550\u2550\u2550\u2550\u2550\u2550\u2550\u2550\u2550\u2550\u2550\u2550\u2550\u2550\u2550\u2550\u2550\u2550\u2550\u2550\u2550\u2550\u2550\u2550\u2550\u2550\u2550\u2550\u2550\u2550\u2550\u2550\u2550\u2550\u2550\u2550\u2550\u2550\u2550\u2550\u2550\u2550\u2550\u2550\u2550\u2550\u2550\u2550\n    (TrendMicro_XDR_OAT_V2_CL\n     | extend source_table = \"ccf\"\n    )\n"
    },
    "resources": [
        {
            "type": "Microsoft.OperationalInsights/workspaces/savedSearches",
            "apiVersion": "2020-08-01",
            "name": "[concat(parameters('workspace'), '/', variables('functionName'))]",
            "location": "[parameters('workspace-location')]",
            "properties": {
                "displayName": "[variables('functionName')]",
                "category": "[variables('category')]",
                "functionAlias": "[variables('functionAlias')]",
                "query": "[variables('functionQuery')]",
                "version": 2
            }
        }
    ],
    "outputs": {
        "functionName": {
            "type": "string",
            "value": "[variables('functionName')]"
        },
        "message": {
            "type": "string",
            "value": "\u2705 Parser function deployed! Usage: TrendMicroOAT_Complete() | where detail_filterRiskLevel_s == 'high'"
        }
    }
}
